{
  "request_id": "acquisition-packet-example",
  "company": "ShadowProof Bridge (pre-commercial)",
  "version": "0.25.7",
  "release_stage": "acquisition_clean_pre_commercial_pilot_packet",
  "deliverables": [
    "Lean-acceptance gateway with theorem-fingerprint lock",
    "ShadowHoTT bilattice routing layer (L = 2 x 2)",
    "Three-layer sorry / axiom / drift sieve",
    "Hardened multi-tenant scaffolding (auth, quota, OIDC, OTel, Prometheus)",
    "Postgres / Redis / Docker Compose pilot stack"
  ],
  "outstanding_for_ga": [
    "External security review",
    "Customer-specific model and retrieval adapters",
    "Real Lean CI transcript at production scale",
    "Large evaluation corpora",
    "Signed registry publishing pipeline",
    "Legal/SLA work"
  ]
}
